<?xml version="1.0" encoding="UTF-8"?>
<!DOCTYPE scene SYSTEM "norme.dtd">
<scene name="France's flag">
  <plane>
    <origin x="0" y="-1.000000" z="0"/>
    <normal x="0" y="1.000000" z="0"/>
    <color r="123" g="123" b="200"/>
    <reflection data="0"/>
    <refraction data="1"/>
  </plane>
   <sphere>
    <pos x="1" y="0" z="1.000000"/>
    <radius data="0.400000"/>
    <color r="50" g="50" b="255"/>
    <reflection data="0"/>
    <refraction data="1"/>
  </sphere> 
   <sphere>
    <pos x="0" y="0.300000" z="1.000000"/>
    <radius data="0.400000"/>
    <color r="50" g="50" b="255"/>
    <reflection data="0"/>
    <refraction data="1"/>
  </sphere>
  <sphere>
    <pos x="0" y="0.600000" z="1.000000"/>
    <radius data="0.400000"/>
    <color r="50" g="50" b="255"/>
    <reflection data="0"/>
    <refraction data="1"/>
  </sphere> 
  <sphere>
    <pos x="0" y="0.900000" z="1.000000"/>
    <radius data="0.400000"/>
    <color r="50" g="50" b="255"/>
    <reflection data="0"/>
    <refraction data="1"/>
  </sphere>
  <sphere>
    <pos x="0.500000" y="0" z="1.000000"/>
    <radius data="0.400000"/>
    <color r="255" g="255" b="255"/>
    <reflection data="0"/>
    <refraction data="1"/>
  </sphere>
  <sphere>
    <pos x="0.500000" y="0.300000" z="1.000000"/>
    <radius data="0.400000"/>
    <color r="255" g="255" b="255"/>
    <reflection data="0"/>
    <refraction data="1"/>
  </sphere>
  <sphere>
    <pos x="0.500000" y="0.600000" z="1.000000"/>
    <radius data="0.400000"/>
    <color r="255" g="255" b="255"/>
    <reflection data="0"/>
    <refraction data="1"/>
  </sphere>
  <sphere>
    <pos x="0.500000" y="0.900000" z="1.000000"/>
    <radius data="0.400000"/>
    <color r="255" g="255" b="255"/>
    <reflection data="0"/>
    <refraction data="1"/>
  </sphere>
  <sphere>
    <pos x="1.000000" y="0" z="1.000000"/>
    <radius data="0.400000"/>
    <color r="255" g="30" b="20"/>
    <reflection data="0"/>
    <refraction data="1"/>
  </sphere>
  <sphere>
    <pos x="1.000000" y="0.300000" z="1.000000"/>
    <radius data="0.400000"/>
    <color r="255" g="30" b="20"/>
    <reflection data="0"/>
    <refraction data="1"/>
  </sphere>
  <sphere>
    <pos x="1.000000" y="0.600000" z="1.000000"/>
    <radius data="0.400000"/>
    <color r="255" g="30" b="20"/>
    <reflection data="0"/>
    <refraction data="1"/>
  </sphere>
  <sphere>
    <pos x="1.000000" y="0.900000" z="1.000000"/>
    <radius data="0.400000"/>
    <color r="255" g="30" b="20"/>
    <reflection data="0"/>
    <refraction data="1"/>
  </sphere>
  <light>
    <pos x="0.500000" y="0.500000" z="-5.000000"/>
    <color r="255" g="255" b="255"/>
    <intensity data="0.500000"/>
  </light>
  <light>
    <pos x="0" y="0.200000" z="-5.000000"/>
    <color r="100" g="100" b="100"/>
    <intensity data="0.400000"/>
  </light>
  <light>
    <pos x="-0.500000" y="0.500000" z="-3.000000"/>
    <color r="255" g="255" b="255"/>
    <intensity data="0.500000"/>
  </light>
  <ambient>
    <color r="255" g="255" b="255"/>
    <intensity data="0.500000"/>
  </ambient>
  <camera>
    <pos x="5.000000" y="0.300000" z="-10.000000"/>
    <dir x="0" y="0" z="1.000000"/>
  </camera>
</scene>
