<?xml version="1.0" encoding="UTF-8" ?>
<!DOCTYPE scene SYSTEM "../dtd/norme.dtd">
<scene name="new file">
  <plane>
    <origin x="0" y="-1.000000" z="0"/>
    <normal x="0" y="1.000000" z="0"/>
    <color r="163" g="163" b="163"/>
    <reflection data="0"/>
    <refraction data="0"/>
  </plane>
  <light>
    <pos x="0" y="30.000000" z="-30.000000"/>
    <dir x="0" y="0.000000" z="-30.000000"/>
    <color r="255" g="255" b="255"/>
    <intensity data="0.699999"/>
    <type data="POINT"/>
  </light>
  <ambient>
    <color r="255" g="255" b="255"/>
    <intensity data="0.200000"/>
  </ambient>
  <camera>
    <pos x="0" y="0" z="-12.000000"/>
    <dir x="0" y="0" z="1.000000"/>
  </camera>
</scene>
