<?xml version="1.0" encoding="UTF-8"?>
<!DOCTYPE scene SYSTEM "norme.dtd">
<scene name=" file">
  <plane>
    <origin x="0" y="-1.000000" z="0"/>
    <normal x="0" y="1.000000" z="0"/>
    <color r="236" g="205" b="62"/>
    <chess r="0" g="0" b="0"/>
    <reflection data="0.500000"/>
    <refraction data="0"/>
  </plane>
  <sphere>
    <pos x="0" y="2.800000" z="-1.600000"/>
    <radius data="1.200000"/>
    <color r="168" g="168" b="168"/>
    <reflection data="1.000000"/>
    <refraction data="0"/>
  </sphere>
  <sphere>
    <pos x="-0.400000" y="3.000000" z="-2.700000"/>
    <radius data="0.200000"/>
    <color r="245" g="246" b="245"/>
    <reflection data="0"/>
    <refraction data="1.500000"/>
  </sphere>
  <sphere>
    <pos x="0.400000" y="3.000000" z="-2.700000"/>
    <radius data="0.200000"/>
    <color r="248" g="248" b="247"/>
    <reflection data="0"/>
    <refraction data="1.500000"/>
  </sphere>
  <paraboloid>
    <top x="-1.600000" y="0.500000" z="-1.700000"/>
    <normal x="0" y="-1.000000" z="-0.200000"/>
    <radius data="0.020000"/>
    <height data="0.100000"/>
    <color r="205" g="168" b="0"/>
    <reflection data="1.000000"/>
    <refraction data="0"/>
  </paraboloid>
  <paraboloid>
    <top x="1.600000" y="0.500000" z="-1.700000"/>
    <normal x="0" y="-1.000000" z="-0.200000"/>
    <radius data="0.020000"/>
    <height data="-0.100000"/>
    <color r="205" g="168" b="0"/>
    <reflection data="1.000000"/>
    <refraction data="0"/>
  </paraboloid>
  <light>
    <pos x="0" y="0" z="-8.000000"/>
    <color r="255" g="255" b="255"/>
    <intensity data="0.800000"/>
  </light>
  <light>
    <pos x="0" y="0" z="0"/>
    <color r="255" g="255" b="255"/>
    <intensity data="0.100000"/>
  </light>
  <ambient>
    <color r="255" g="255" b="255"/>
    <intensity data="0.400000"/>
  </ambient>
  <camera>
    <pos x="15.000000" y="1.000000" z="-20.000000"/>
    <dir x="-1.000000" y="1.000000" z="1.000000"/>
  </camera>
</scene>
