<?xml version="1.0" encoding="UTF-8" ?>
<!DOCTYPE scene SYSTEM "../dtd/norme.dtd">
<scene name="2 Spheres">

<camera>
  <pos x="0" y="0" z="-3" />
  <dir x="0" y="0" z="1" />
  <rot x="0" y="0" z="0" />
  <tra x="0" y="0" z="0" />
</camera>
<ambient>

  <color r="255" g="255" b="255" />
  <intensity data="1" />
</ambient>
<light>
  <pos x="0" y="0" z="-2" />
  <dir x="0" y="2" z="1" />
  <color r="255" g="255" b="255" />
  <intensity data="1" />
</light>

<!--light>
  <pos x="0" y="0" z="5" />
  <dir x="0" y="0" z="1" />
  <color r="255" g="255" b="255" a="0.5" />
  <intensity data="1" />
</light-->

<ambient>
  <color r="255" g="255" b="255" />
  <intensity data="0.4" />
</ambient>

<plane>
  <origin x="0" y="-1" z="0" />
  <normal x="0" y="1" z="0" />
  <rot x="0" y="0" z="0" />
  <color r="255" g="255" b="255" />
  <chess r="0" g="0" b="0" />
  <reflection data="0" />
</plane>

<!--sphere>
  <pos x="0.5" y="0.5" z="1" />
  <radius data="0.4" />
  <color r="20" g="20" b="120" />
  <transparence data="0.90" />
</sphere>-->

<cone>
  <pos x="-0.5" y="0" z="0" />
  <normal x="0" y="1" z="0" />
  <radius data="0.35" />
  <height data="0.5" />
  <color r="0" g="255" b="0" />
  <reflection data="0" />
</cone>

<!-- <triangle>
  <pos x="0" y="0" z="0" />
  <normal x="1" y="0" z="0" />
  <v1 x="0" y="1.2" z="0" />
  <v2 x="1" y="1.2" z="0" />
  <color r="1" g="0" b="255" a="1" />
  <reflection data="1" />
</triangle> -->

<!-- <cone>
  <pos x="1" y="0.3" z="0" />
  <normal x="1" y="1.3" z="-0.3" />
  <radius data="0.45" />
  <height data="0.5" />
  <color r="0" g="255" b="0" a="1" />
</cone> -->

<!-- <light>
     <pos x="0" y="4" z="0" />
     <dir x="1" y="0" z="0" />
     <color r="0" g="255" b="50" a="1" />
     <intensity data="0.3" />
</light> -->

<!-- <ambient>
     <color r="0" g="255" b="50" a="1" />
     <intensity data="0.4" />
</ambient> -->

<!-- <disk>
     <origin x="0" y="-1" z="2" />
     <normal x="0" y="0" z="2" />
     <radius data="1" />
     <rot x="0" y="0" z="0" />
     <color r="0" g="255" b="0" a="1" />
</disk>

<disk>
  <origin x="-0.5" y="-0.5" z="2" />
  <normal x="0" y="0" z="2" />
  <radius data="0.5" />
  <rot x="0" y="0" z="0" />
  <color r="0" g="0" b="255" a="1" />
</disk> -->
<!-- <paraboloid>
     <top x="0" y="0" z="0" />
     <normal x="0" y="1" z="1" />
     <radius data="0.2" />
     <height data="1" />
     <color r="255" g="0" b="0" a="1" />
</paraboloid> -->

<!-- <hyperboloid>
     <top x="0" y="0" z="0" />
     <normal x="0" y="1" z="0" />
     <radius data="0.2" />
     <height data="1" />
     <color r="0" g="255" b="0" a="1" />
</hyperboloid> -->

</scene>
