<?xml version="1.0" encoding="UTF-8" ?>
<!DOCTYPE scene SYSTEM "norme.dtd">
<scene name="Empty file">

<camera>
  <pos x="0" y="0" z="-20" />
  <dir x="0" y="0" z="1" />
  <rot x="0" y="0" z="0" />
  <tra x="0" y="0" z="0" />
</camera>

<light>
  <pos x="0" y="0" z="-2" />
  <dir x="0" y="2" z="1" />
  <color r="255" g="255" b="255" />
  <intensity data="1" />
</light>

<ambient>
  <color r="255" g="255" b="255" />
  <intensity data="0.4" />
</ambient>

</scene>
