<?xml version="1.0" encoding="UTF-8"?>
<!DOCTYPE scene SYSTEM "norme.dtd">
<scene name="BoxColor">
  <plane>
    <origin x="0" y="-1.300000" z="0"/>
    <normal x="0" y="1.000000" z="0"/>
    <color r="226" g="222" b="72"/>
    <reflection data="0.999998"/>
    <refraction data="1.200000"/>
  </plane>
  <plane>
    <origin x="-11.000000" y="0" z="0"/>
    <normal x="2.000000" y="0" z="0"/>
    <color r="216" g="38" b="38"/>
    <reflection data="1.000000"/>
    <refraction data="1.200000"/>
  </plane>
  <sphere>
    <pos x="-2.200000" y="1.000000" z="0"/>
    <radius data="2.000000"/>
    <color r="185" g="26" b="26"/>
    <reflection data="0.699999"/>
    <refraction data="0"/>
  </sphere>
  <sphere>
    <pos x="-5.500000" y="6.000000" z="3.500000"/>
    <radius data="1.000000"/>
    <color r="157" g="123" b="38"/>
    <reflection data="0"/>
    <refraction data="0.699999"/>
  </sphere>
  <sphere>
    <pos x="-6.200000" y="2.000000" z="2.200000"/>
    <radius data="1.000000"/>
    <color r="138" g="105" b="100"/>
    <reflection data="0"/>
    <refraction data="0.324999"/>
  </sphere>
  <cylinder>
    <pos x="-13.900000" y="-1.000000" z="0"/>
    <normal x="0.899999" y="1.600000" z="0"/>
    <radius data="0.500000"/>
    <color r="211" g="229" b="25"/>
    <reflection data="0.200000"/>
    <refraction data="0"/>
  </cylinder>
  <cone>
    <pos x="-8.000000" y="3.000000" z="-0.500000"/>
    <normal x="-8.601555" y="-1.877240" z="1.655057"/>
    <radius data="0.700000"/>
    <height data="1.600000"/>
    <min x="1.000000" y="1.000000" z="1.000000"/>
    <max x="3.000000" y="3.000000" z="3.000000"/>
    <color r="224" g="127" b="11"/>
    <reflection data="0"/>
    <refraction data="0"/>
  </cone>
  <torus>
    <pos x="1.099999" y="4.899999" z="-3.300000"/>
    <radius_small data="0.600000"/>
    <radius_big data="1.100000"/>
    <color r="116" g="182" b="14"/>
    <reflection data="0.300000"/>
    <refraction data="0"/>
  </torus>
  <light>
    <pos x="-9.000000" y="10.000000" z="-3.000000"/>
    <color r="103" g="104" b="83"/>
    <intensity data="0.300000"/>
    <type data="POINT"/>
  </light>
  <light>
    <pos x="3" y="2" z="5.000000"/>
    <color r="104" g="165" b="143"/>
    <intensity data="0.700000"/>
    <type data="POINT"/>
  </light>
  <ambient>
    <color r="255" g="255" b="255"/>
    <intensity data="0.400000"/>
  </ambient>
  <camera>
    <pos x="-7.000000" y="5.000000" z="-69.100000"/>
    <dir x="-7.652467" y="3.945170" z="-45.077105"/>
  </camera>
</scene>