<?xml version="1.0" encoding="UTF-8" ?>
<!DOCTYPE scene SYSTEM "../dtd/norme.dtd">
<scene name="One sphere">

<camera>
	<pos x="-1" y="0.3" z="-10" />
	<dir x="0" y="0" z="1" />
	<!-- <tra x="-1" y="0" z="0" /> -->
</camera>

<light>
	<pos x="0.5" y="0.5" z="-5" />
	<color r="255" g="255" b="255" a="1" />
	<intensity data="0.5" />
</light>

<light>
	<pos x="0" y="0.2" z="-5" />
	<color r="100" g="100" b="100" a="1" />
	<intensity data="0.4" />
</light>

<light>
	<pos x="-0.5" y="0.5" z="-3" />
	<color r="255" g="255" b="255" a="1" />
	<intensity data="0.5" />
</light>

<sphere>
	<pos x="2" y="0" z="-3" />
	<radius data="0.4" />	
	<tra x="0" y="0" z="0" />
	<color r="255" g="125" b="255" a="1" />
	<reflection data="0" />
</sphere>

<sphere>
	<pos x="0.2" y="0" z="-2" />
	<radius data="0.5" />	
	<tra x="0" y="0" z="0" />
	<color r="255" g="125" b="255" a="1" />
	<!--<reflection data="-1" />    -->
	<refraction data="1.01" />	
</sphere>

<plane>
	<origin x="0" y="-1" z="0" />
	<normal x="0" y="1" z="0" />
	<rot x="0" y="0" z="0" />
	<color r="123" g="123" b="200" a="1" />
	<reflection data="0" />
</plane>

<plane>
	<origin x="0" y="0" z="2" />
	<normal x="0" y="0" z="-1" />
	<rot x="0" y="0" z="0" />
	<color r="123" g="123" b="200" a="1" />
	<reflection data="0" />
</plane>

<cylinder>
	<pos x="0.5" y="0" z="1" />
	<normal x="0.5" y="1" z="1" />
	<radius data="0.5" />
	<rot x="0" y="0" z="0" />
	<color r="151" g="20" b="42" a="1" />
</cylinder>

</scene>