<?xml version="1.0" encoding="UTF-8"?>
<!DOCTYPE scene SYSTEM "norme.dtd">
<scene name="BoxColor">
  <plane>
    <origin x="6.299999" y="0" z="0"/>
    <normal x="-1.000000" y="0" z="0"/>
    <color r="231" g="4" b="4"/>
    <reflection data="1.000000"/>
    <refraction data="0"/>
  </plane>
  <plane>
    <origin x="-6.599999" y="0" z="0"/>
    <normal x="1.000000" y="0" z="0"/>
    <color r="30" g="193" b="152"/>
    <reflection data="1.000000"/>
    <refraction data="0"/>
  </plane>
  <plane>
    <origin x="0" y="3.000000" z="0"/>
    <normal x="0" y="1.000000" z="0"/>
    <color r="87" g="100" b="177"/>
    <reflection data="1.000000"/>
    <refraction data="0"/>
  </plane>
  <plane>
    <origin x="0" y="0" z="20.000000"/>
    <normal x="0" y="0" z="-1.000000"/>
    <color r="236" g="205" b="62"/>
    <reflection data="1.000000"/>
    <refraction data="0"/>
  </plane>
  <plane>
    <origin x="0" y="-3.000000" z="0"/>
    <normal x="0" y="1.000000" z="0"/>
    <color r="105" g="213" b="59"/>
    <reflection data="1.000000"/>
    <refraction data="0"/>
  </plane>
  <sphere>
    <pos x="-4.000000" y="0" z="17.500000"/>
    <radius data="1.500000"/>
    <color r="19" g="126" b="34"/>
    <reflection data="0"/>
    <refraction data="0"/>
  </sphere>
  <sphere>
    <pos x="3.000000" y="0" z="4.300000"/>
    <radius data="2.100000"/>
    <color r="236" g="54" b="12"/>
    <reflection data="0"/>
    <refraction data="0"/>
  </sphere>
  <sphere>
    <pos x="2.000000" y="-1.000000" z="-28.500000"/>
    <radius data="0.700000"/>
    <color r="100" g="193" b="14"/>
    <chess r="47" g="163" b="10"/>
    <reflection data="0"/>
    <refraction data="0"/>
  </sphere>
  <cylinder>
    <pos x="5.000000" y="-1.300000" z="4.000000"/>
    <normal x="-0.400000" y="0.200000" z="0"/>
    <radius data="0.500000"/>
    <color r="15" g="60" b="163"/>
    <reflection data="0"/>
    <refraction data="0"/>
  </cylinder>
  <cone>
    <pos x="2.000000" y="0" z="2.500000"/>
    <normal x="1.676582" y="0.637511" z="2.834193"/>
    <radius data="0.100000"/>
    <height data="0"/>
    <min x="1.000000" y="1.000000" z="1.000000"/>
    <max x="3.000000" y="3.000000" z="3.000000"/>
    <color r="226" g="16" b="92"/>
    <reflection data="0"/>
    <refraction data="0"/>
  </cone>
  <light>
    <pos x="5.000000" y="-2.299999" z="-24.000000"/>
    <color r="255" g="255" b="255"/>
    <intensity data="0.899999"/>
    <type data="POINT"/>
  </light>
  <light>
    <pos x="0" y="0" z="0"/>
    <color r="255" g="255" b="255"/>
    <intensity data="0.100000"/>
    <type data="POINT"/>
  </light>
  <light>
    <pos x="0" y="0" z="0"/>
    <color r="255" g="255" b="255"/>
    <intensity data="0.100000"/>
    <type data="POINT"/>
  </light>
  <ambient>
    <color r="255" g="255" b="255"/>
    <intensity data="0.200000"/>
  </ambient>
  <camera>
    <pos x="0" y="0" z="-50.000000"/>
    <dir x="0" y="0" z="1.000000"/>
  </camera>
</scene>
