<?xml version="1.0" encoding="UTF-8"?>
<!DOCTYPE scene SYSTEM "norme.dtd">
<scene name=" file">
  <disk>
    <origin x="0.300000" y="0" z="0"/>
    <normal x="0.400000" y="2.200000" z="0.500000"/>
    <radius data="0.400000"/>
    <color r="236" g="205" b="62"/>
    <reflection data="0"/>
    <refraction data="0"/>
  </disk>
  <light>
    <pos x="0" y="0" z="-2.000000"/>
    <color r="255" g="255" b="255"/>
    <intensity data="1.000000"/>
  </light>
  <ambient>
    <color r="255" g="255" b="255"/>
    <intensity data="0.400000"/>
  </ambient>
  <camera>
    <pos x="0" y="0" z="-20.000000"/>
    <dir x="0" y="0" z="1.000000"/>
  </camera>
</scene>
