<?xml version="1.0" encoding="UTF-8" ?>
<!DOCTYPE scene SYSTEM "norme.dtd">
<scene name="Just a plane">

<camera>
	<pos x="0" y="1" z="-5" />
	<dir x="0" y="1" z="1" />
</camera>

<ambient>
	<color r="100" g="100" b="100" a="1" />
	<intensity data="0" />
</ambient>

<plane>
	<origin x="0" y="-0.5" z="1" />
	<normal x="0" y="-2" z="1" />
	<rot x="0" y="0" z="0" />
	<color r="255" g="245" b="255" a="1" />
	<reflection data="0" />
</plane>

<light>
	<pos x="0" y="0" z="10" />
	<color r="255" g="255" b="255" a="1" />
	<intensity data="0.5" />
</light>

</scene>
