<?xml version="1.0" encoding="UTF-8" ?>
<!DOCTYPE scene SYSTEM "norme.dtd">
<scene name="2 Spheres">

<camera>
	<pos x="0" y="0" z="-5" />
	<dir x="0" y="0" z="1" />
	<rot x="0" y="1" z="0" />
	<tra x="0.5" y="0" z="0" />
</camera>

<light>
	<pos x="0" y="-2" z="-2" />
	<dir x="1" y="0" z="1" />
	<color r="0" g="255" b="50" a="1" />
	<intensity data="1" />
</light>

<light>
	<pos x="0" y="2" z="-2" />
	<dir x="-2" y="0" z="0" />
	<color r="0" g="255" b="50" a="1" />
	<intensity data="0.3" />
</light>

<!-- <ambient>
	<color r="0" g="255" b="50" a="1" />
	<intensity data="0.1" />
</ambient> -->

<plane>
	<origin x="0" y="-1" z="1" />
	<normal x="0" y="-2" z="1" />
	<color r="255" g="255" b="255" a="1" />
	<reflection data="0" />
</plane>

<sphere>
	<pos x="-1" y="0" z="10" />
	<tra x="0" y="1" z="0" />
	<radius data="0.5" />
	<color r="255" g="255" b="255" a="1" />
	<reflection data="1" />
</sphere>

<sphere>
	<pos x="0" y="0" z="2" />
	<tra x="0" y="0" z="0" />
	<radius data="0.5" />
	<color r="255" g="255" b="255" a="1" />
	<reflection data="2" />
</sphere>

</scene>
