<?xml version="1.0" encoding="UTF-8" ?>
<!DOCTYPE scene SYSTEM "../dtd/norme.dtd">
<scene name="Just a Paraboloid">
<camera>
	<pos x="0" y="0" z="-10" />
	<dir x="0" y="0" z="1" />
	<rot x="0" y="0" z="0" />
	<tra x="0" y="0" z="0" />
</camera>
<ambient>
	<color r="255" g="255" b="255" />
	<intensity data="0.1" />
</ambient>
<light>
	<pos x="0" y="2" z="-5" />
	<color r="255" g="255" b="255" />
	<intensity data="1" />
</light>
<paraboloid>
	<top x="0" y="-1" z="5" />
	<normal x="0" y="3" z="5" />
	<radius data="0.1" />
	<height data="1" />
	<color r="0" g="102" b="255" />
	<reflection data="0" />
</paraboloid>

<!-- <hyperboloid>
	<top x="0" y="0" z="0" />
	<normal x="0" y="1" z="0" />
	<radius data="0.2" />
	<height data="1" />
	<color r="0" g="255" b="0" />
</hyperboloid> -->

<cylinder>
	<pos x="-1" y="0" z="-0.5" />
	<normal x="-1" y="1" z="-0.5" />
	<radius data="0.1" />
	<rot x="0" y="0" z="0" />
	<color r="0" g="102" b="255" />
	<reflection data="1" />
</cylinder>

</scene>
