<?xml version="1.0" encoding="UTF-8" ?>
<!DOCTYPE scene SYSTEM "../dtd/norme.dtd">
<scene name="Test 1">
<mobius>
	<pos x="0" y="0" z="-0.500000" />
    <radius data="0.200000" />
    <color r="236" g="205" b="162" />
    <reflection data="0"/>
    <refraction data="0"/>
    <transparence data="0"/>
</mobius>
<plane>
	<origin x="0" y="-2" z="0" />
	<normal x="0" y="1" z="0" />
	<color r="123" g="123" b="200" />
	<reflection data="0" />
</plane>
<light>
	<pos x="-3" y="-2" z="-4" />
	<color r="255" g="255" b="255" />
	<intensity data="1" />
</light>
<light>
	<pos x="1" y="1" z="-3" />
	<color r="255" g="255" b="255" />
	<intensity data="1" />
</light>
<light>
	<pos x="-1" y="1" z="-3" />
	<color r="255" g="255" b="255" />
	<intensity data="1" />
</light>
<ambient>
	<color r="255" g="255" b="255" />
	<intensity data="0.1" />
</ambient>
<camera>
	<pos x="-2" y="2" z="-50" />
	<dir x="3" y="2" z="1" />
</camera>

</scene>
