<?xml version="1.0" encoding="UTF-8" ?>
<!DOCTYPE scene SYSTEM "../dtd/norme.dtd">
<scene name="One sphere">
<camera>
	<pos x="0" y="0" z="-10" />
	<dir x="0" y="0" z="1" />
	<rot x="0" y="0" z="0" />
	<tra x="0" y="0" z="0" />
</camera>
<ambient>
	<color r="255" g="255" b="255" a="1" />
	<intensity data="0.1" />
</ambient>
<light>
	<pos x="3" y="2" z="-4" />
	<color r="255" g="255" b="255" a="1" />
	<intensity data="1" />
</light>
<sphere>
	<pos x="0" y="0" z="1" />
	<radius data="0.4" />
	<tra x="0" y="0" z="0" />
	<color r="255" g="125" b="255" a="1" />
	<reflection data="0" />
</sphere>
</scene>
