<?xml version="1.0" encoding="UTF-8" ?>
<!DOCTYPE scene SYSTEM "norme.dtd">
<scene name="Cool gallery">
  <plane>
    <origin x="0" y="0.750000" z="1.000000"/>
    <normal x="0" y="0" z="1.000000"/>
    <color r="255" g="255" b="255"/>
    <reflection data="0"/>
    <refraction data="1.000000"/>
  </plane>
  <plane>
    <origin x="0" y="-0.750000" z="1.000000"/>
    <normal x="0" y="0" z="1.000000"/>
    <color r="151" g="20" b="42"/>
    <reflection data="0"/>
    <refraction data="1.000000"/>
  </plane>
  <plane>
    <origin x="0" y="0" z="2.000000"/>
    <normal x="0" y="0" z="1.000000"/>
    <color r="125" g="0" b="125"/>
    <reflection data="0"/>
    <refraction data="1.000000"/>
  </plane>
  <sphere>
    <pos x="0.750000" y="0.750000" z="0.500000"/>
    <radius data="0.200000"/>
    <color r="236" g="205" b="62"/>
    <reflection data="0"/>
    <refraction data="1.000000"/>
  </sphere>
  <sphere>
    <pos x="-0.750000" y="0.750000" z="0.500000"/>
    <radius data="0.200000"/>
    <color r="236" g="205" b="62"/>
    <reflection data="0"/>
    <refraction data="1.000000"/>
  </sphere>
  <sphere>
    <pos x="1.000000" y="0.750000" z="-0.500000"/>
    <radius data="0.200000"/>
    <color r="236" g="205" b="62"/>
    <reflection data="0"/>
    <refraction data="1.000000"/>
  </sphere>
  <sphere>
    <pos x="-1.000000" y="0.750000" z="-0.500000"/>
    <radius data="0.200000"/>
    <color r="236" g="205" b="62"/>
    <reflection data="0"/>
    <refraction data="1.000000"/>
  </sphere>
  <sphere>
    <pos x="0.750000" y="-0.750000" z="0.500000"/>
    <radius data="0.200000"/>
    <color r="236" g="205" b="62"/>
    <reflection data="0"/>
    <refraction data="1.000000"/>
  </sphere>
  <sphere>
    <pos x="-0.750000" y="-0.750000" z="0.500000"/>
    <radius data="0.200000"/>
    <color r="236" g="205" b="62"/>
    <reflection data="0"/>
    <refraction data="1.000000"/>
  </sphere>
  <sphere>
    <pos x="1.000000" y="-0.750000" z="-0.500000"/>
    <radius data="0.200000"/>
    <color r="236" g="205" b="62"/>
    <reflection data="0"/>
    <refraction data="1.000000"/>
  </sphere>
  <sphere>
    <pos x="0" y="0" z="0"/>
    <radius data="0.200000"/>
    <color r="255" g="0" b="0"/>
    <reflection data="1.000000"/>
    <refraction data="1.500000"/>
  </sphere>
  <cylinder>
    <pos x="-0.750000" y="0" z="0.500000"/>
    <normal x="0" y="1.000000" z="0"/>
    <radius data="0.100000"/>
    <color r="151" g="20" b="42"/>
    <reflection data="0"/>
    <refraction data="1.000000"/>
  </cylinder>
  <cylinder>
    <pos x="0.750000" y="0" z="0.500000"/>
    <normal x="0" y="1.000000" z="0"/>
    <radius data="0.100000"/>
    <color r="151" g="20" b="42"/>
    <reflection data="0"/>
    <refraction data="1.000000"/>
  </cylinder>
  <cylinder>
    <pos x="-1.000000" y="0" z="-0.500000"/>
    <normal x="0" y="1.000000" z="0"/>
    <radius data="0.100000"/>
    <color r="151" g="20" b="42"/>
    <reflection data="0"/>
    <refraction data="1.000000"/>
  </cylinder>
  <cylinder>
    <pos x="1.000000" y="0" z="-0.500000"/>
    <normal x="0" y="1.000000" z="0"/>
    <radius data="0.100000"/>
    <color r="151" g="20" b="42"/>
    <reflection data="0"/>
    <refraction data="1.000000"/>
  </cylinder>
  <light>
    <pos x="0" y="0" z="-2.000000"/>
    <color r="255" g="255" b="255"/>
    <intensity data="1.000000"/>
    <type data="POINT"/>
  </light>
  <light>
    <pos x="-2.000000" y="0" z="-5.000000"/>
    <color r="255" g="255" b="255"/>
    <intensity data="1.000000"/>
    <type data="POINT"/>
  </light>
  <ambient>
    <color r="255" g="255" b="255"/>
    <intensity data="0.400000"/>
  </ambient>
  <camera>
    <pos x="0" y="0" z="-10.000000"/>
    <dir x="0" y="0" z="1.000000"/>
  </camera>
</scene>
