<?xml version="1.0" encoding="UTF-8" ?>
<!DOCTYPE scene SYSTEM "norme.dtd">
<scene name="Just a cylinder">
<camera>
	<pos x="0" y="0" z="-10" />
	<dir x="0" y="0" z="1" />
</camera>
<ambient>
	<color r="255" g="255" b="255" />
	<intensity data="0.1" />
</ambient>
<light>
	<pos x="0.5" y="0.5" z="-5" />
	<color r="255" g="255" b="255" />
	<intensity data="0.5" />
</light>

<light>
	<pos x="0" y="0.2" z="-5" />
	<color r="100" g="100" b="100" />
	<intensity data="0.4" />
</light>

<light>
	<pos x="-0.5" y="0.5" z="-3" />
	<color r="255" g="255" b="255" />
	<intensity data="0.5" />
</light>

<cylinder>
	<pos x="0" y="0" z="3" />
	<normal x="0" y="1" z="3" />
	<radius data="0.4" />
	<rot x="0" y="0" z="0" />
	<color r="255" g="125" b="255" />
	<reflection data="0" />
</cylinder>
<plane>
	<origin x="0" y="-1" z="0" />
	<normal x="0" y="1" z="0" />
	<rot x="0" y="0" z="0" />
	<color r="123" g="123" b="200" />
	<reflection data="0" />
</plane>
</scene>
