<?xml version="1.0" encoding="UTF-8" ?>
<!DOCTYPE scene SYSTEM "norme.dtd">
<scene name="2 Spheres">

<camera>
  <pos x="-0.5" y="0" z="-1.1" />
  <dir x="0" y="3" z="1" />
  <rot x="0" y="0" z="0" />
  <tra x="0" y="4.5" z="0" />
</camera>

<light>
  <pos x="0" y="0" z="-5" />
  <dir x="0" y="0" z="1" />
  <color r="255" g="255" b="255" a="1" />
  <intensity data="1" />
</light>

<ambient>
  <color r="255" g="255" b="255" a="1" />
  <intensity data="0.3" />
</ambient>

<plane>
  <origin x="0" y="-2" z="0" />
  <normal x="0" y="-1" z="0" />
  <rot x="0" y="10" z="0" />
  <color r="255" g="255" b="255" a="1" />
  <chess r="0" g="0" b="0"/>
  <reflection data="0" />
</plane>

<torus>
  <pos x="1" y="0" z="5" />
  <radius_small data="0.5" />
  <radius_big data="1" />
  <color r="84" g="133" b="64" a="1" />
  <chess r="0" g="0" b="0"/>
</torus>

</scene>
